{"expected_case_set_digest":"sha256:8c2e364c5bcd583ca5b6196712ef8615251581b1be5c964355f6fa731767ee93","format":"invarlock/comparison-policy-v1","metrics":[{"accepted_provenance":{"kind":"external_metric","rubric_digest":"sha256:a09ee7d0cb4f8b92fa3b1ae0badc4ceacca8b0414b8e07ffa8b686d82060a9b6","source":"native_active_intent_exact_label_edge_whitespace","unit":"score","version":"86378f4acb5b6d739f18e4f51f8e12030d26d480066784249c6833e73a9f007d"},"aggregation":"mean","configuration":{},"direction":"higher","kind":"recorded","maximum_interval_width":0.05,"maximum_regression":0.05,"minimum_count":2000,"name":"native_quality","score_key":"native_quality","subject_minimum":0.8,"unit":"score"}],"slices":[{"name":"early_history","where":{"slice":"early_history"}},{"name":"later_history","where":{"slice":"later_history"}}]}
